Unnamed: 0,QID,Brand,Model,Question,Dialogue,Report
0,Q5001,福特,福克斯,长安福特福克斯，突然打不着车,技师说：你好车主，根据提供图片，这是车辆防盗系统起作用了，需要从新匹配车辆的所有的钥匙。|车主说：哦|技师说：需要联系当地4s店，或者专业做汽车钥匙的|车主说：OK,根据提供图片，这是车辆防盗起作用了，需要从新匹配钥匙。
1,Q5002,路虎,揽胜运动版,路虎电动脚踏板无反应，请问是什么原因，如何解决？,技师说：电机接触不良吧|车主说：不是，是因为车主右边踏板底盘被刮了，踏板支架被挂断了，现在修复了，但是感觉电机在响，电动踏板不回位，请问如何复位或者匹配脚踏板？|技师说：是不是与踏板脱槽了|车主说：是的，电机之前和踏板脱槽了，现在已经修复上了，但是踏板不正常，开关门几次后现在再开关门有电机声音，但是不复位|技师说：踏板变形了吗？|车主说：现在如何解决？需要匹配电机|车主说：吗|车主说：踏板没变形|技师说：他这个有专门的开关吗？|车主说：16款运动揽胜|技师说：你按开关十秒左右看看能匹配上不|车主说：开关在什么位置|技师说：它开关是怎么控制的|车主说：开门和关门控制的|车主说：[图片]|车主说：这个是开关控制吗|技师说：你常按10秒以上这个开关能学习上不能|车主说：这个是减震放气的|车主说：我按了，就放气|技师说：你按遥控器上的按键试下|车主说：车架号是  SALGA3FV9HA334882|车主说：[图片]|技师说：你找个电脑匹配一下试试|车主说：没反应|车主说：用了，电脑里面关于脚踏板只有维修模式启用和禁用|车主说：都试了，没有用|技师说：那你找当地的专业维修这款车的人员给你看看|车主说：没有复位匹配的方法吗|车主说：我自己就是学修车的，不找别人，咨询可以，要靠自己修|技师说：没有，我修这车也不多,检查踏板与电机是否托槽
2,Q5003,大众,帕萨特,新帕萨特发动机大修后油轨压力高是怎么回事,技师说：你读取一下汽油泵，高压油压|技师说：怠速40巴|车主说：怠速48|车主说：刚换的新高压油泵    现在53|技师说：汽油压力高了，检查高压油泵，凸轮轴，以及高压压力传感器。|车主说：油嘴有没有可能堵了|技师说：大修不清洗喷油嘴？|车主说：我看他也没清洗就装上了|技师说：外面的修理厂，没事设备|车主说：外面的   没使|技师说：没有清洗设备|车主说：嗯没清洗   我在一边看着的    直接装的,大修后出现的问题，需要重点检查高压油泵以及凸轮轴。
3,Q5004,奥迪,奥迪A6L,2010年奥迪a6总是息火,技师说：您好，您的车辆如果熄火之后，还可以启动着车吗？|技师说：多少公里了？|技师说：可以|技师说：我买的二手车现在公里七万|技师说：低速行驶中息火 一天也就一次|技师说：这样的话，您这个车可能是由于积炭多造成的，最好到修理厂检查，清洗喷油嘴和节气门。并匹配节气门。还需要使用解码器，调取故障码，读取数据流看一下，看一下有没有发动机方面的故障，针对排除。|技师说：这个公里数还需要更换汽油滤芯。更换老化的火花塞。清洗三元催化。进气道。如果是正时皮带的，还需要更换正时皮带。这些就是大保养 也是发动机的深度养护。|技师说：都换新的了|技师说：油泵 油嘴 火花塞 都换了|技师说：检测四缸断火 换完以后是一二缸断火|技师说：以前是发动机颤抖 更换完喷油嘴就不抖了|技师说：请问您的咨询服务电话是多少|技师说：[语音]|技师说：我没看到电话咨询|技师说：[语音]|技师说：气缸压力正常|技师说：没有故障码|技师说：缸压多少|技师说：燃烧室积炭检查了吗|技师说：这个我不清楚，4s店检查的|技师说：哦|技师说：没有数据不好说，也许缸压偏低，也有积炭过多引起的|技师说：如果解码器报失火的故障的话，和经常熄火是有关系的。|技师说：还需要使用解码器读取数据流看一下。这个相关的原因很多的。|技师说：并不是解码器调不出故障码来 就没有故障。,您说的这个情况，这个公里数，一般原因是由于积炭太多或者某个传感器信号失准，线路虚接造成的，需要到修理厂检查清洗喷油嘴 节气门 并匹配节气门，更换老化的火花塞，检查清洗三元催化，检查清除燃烧室积炭，更换汽油滤芯儿，使用解码器读取故障码，数据流针对排除故障 修复相关线路，更换损坏部件
4,Q5005,福特,翼搏,曲轴锁止点不是一缸上止点。询问如果按装正时？工具锁不了上止点,技师说：是上止点|技师说：我发图你看。我昨天装上发不了火|技师说：回复下|技师说：测量缸压有吗？|车主说：上止点错了。我按自己感觉对了上止点。发着车了。怕点火正时不太准,重新安装正时
5,Q5006,大众,Passat领驭,更好机油散热器，问题依然没有解决,技师说：仪表亮红色机油灯？|车主说：对|车主说：滴滴几声就恢复正常。请参考原先的提问！|技师说：我到哪去找。|车主说：[图片]|车主说：看到了吗？|技师说：是领驭吗？|车主说：是|车主说：感觉是行驶一段时间后报警。然后是走走停停报警次数增多。|技师说：稍等|技师说：[图片]|技师说：[图片]|技师说：测量一下标准机油压力，如果压力低需要进行相应的检查维修。|车主说：凉车机油压力4个多|车主说：热车才1个|技师说：热车怠速最低1.3|车主说：到不了1.3|技师说：发动机水温多少？|车主说：水温正常|车主说：没有测量温度|技师说：如果水温在80度的时候机油压力不到1.3，说明卸压，如果水温90℃以上，不到1.3说明散热不好。|车主说：好的|车主说：再试试|车主说：这两种情况怎么处理？|技师说：冷车机油粘度大，压力肯定高|车主说：这两种情况怎么解决？|技师说：如果水温80度，机油压力灯亮，说明机械方面有故障，考虑机油泵，以及限压阀，以及机油喷嘴，如果热车机油压力灯亮，重点考虑机油的粘度以及机油散热器，水箱是否堵塞，（也可以往机油里加注抗磨剂）。,根据你的描述，如果发动机水温低，而机油压力低说明是机械方面的故障，可以考虑机油泵，吸油管。以及机油压力调节阀，如果水温高，机油压力低，说明机油散热不好。需要检查散热器以及水箱。
6,Q5007,吉利汽车,吉利GC7,汽车火花塞磁柱上有机油,技师说：你气门室盖垫漏进去的吧|车主说：要怎么修呢|技师说：把气门室盖垫换掉就可以了|车主说：需要换什么配件.一般需要多少钱谢谢|技师说：内外垫，估计100块钱就修好了|技师说：更换气门室盖垫内外垫片,更换内外气门室盖垫
7,Q5008,福特,翼搏,翼博正时皮带怎么安装,技师说：您好，这款车需要曲轴转到一缸压缩上止点，凸轮轴，曲轴都有定位工具定位，挂皮带就可以了。|技师说：[图片]|技师说：[图片]|技师说：[图片]|技师说：我把凸轴都拆下来了。现在VVT不知咋对。正时都是按工具卡对的。没缸压不着车|技师说：[语音]|技师说：[语音]|技师说：现在在家。师父方便留一**不？我微信***70000345。方便加下不？我把缸头都拆下来了。进气卡有二个卡点。晕了。|技师说：如果要付费。我可以支付。|技师说：为一正时皮带头搞大了。这款车第一次修|技师说：2014年1.5手动翼虎。走正时皮带的|技师说：翼博|技师说：不是翼虎是翼博|技师说：[语音]|技师说：[语音]|技师说：好的|技师说：凸轮轴上的VVT螺丝拆了。咋对回？|技师说：嗯，这个我们才来和正殿，我证实对好了，按那个专业工具装了，但是发不着没干呀，最后的调了90度以后再去装一下以后还能顶气门，我以为气门顶坏了，就把缸头拆下来以后，凸轮轴拆下VVT，拆下来后对不了啦。|技师说：[语音]|技师说：好|技师说：在吗|技师说：我曲轴锁止螺丝锁的不是上止高。曲轴的|技师说：师父在不在？|技师说：抱歉，今天我在忙了，让您久等了，有图片吗？发上来看一下|技师说：必须是一缸压缩上止点啊|车主说：自己找的上止点|技师说：您对的凸轮轴vvt轮图片呢 我看一下 您不发图片我怎么和您说呀|技师说：只能告诉您，按照我给您发的图片操作就可以了|技师说：如果您操作已经失误了，气门已经顶了的话，需要抬缸盖|车主说：装好了也发动了。怕时间不对|技师说：那就行了|技师说：怠速 加速正常就没问题了,这款车需要曲轴转到一缸压缩上止点凸轮轴vvt轮 使用专用工具定位，曲轴也有工具定位，下面给您相关图片参考
8,Q5009,广汽传祺,传祺GS8,Gs8进档慢是因为什么,技师说：您好，您的这款车手自一体的广汽传祺属于通病 可以和同款车辆比较一下，发现异常的话需要4s店质保。|技师说：我之前开就没这个毛病|技师说：多少公里了|技师说：如果是新车的话，建议您到4s店保养的时候顺便让师傅帮您检查一下，有异常的话，尽早质保,这个车本身换挡逻辑就不好，新车就有类似这样的情况，属于通病，如果您感觉到和以前差太多，新车最好去4s店保养的时候让修理师傅帮您检查一下，有问题及时质保
9,Q5010,斯柯达,明锐,2013款明锐车载凯立德导航收音机，没有声音，刚开始声音有时有，有时没有，现在彻底没声音了，其它一切都正常，问下大师，这是什么毛病。,技师说：导航能开机吗？|车主说：能开的|车主说：就是没声音|车主说：倒车影像也可以|技师说：那需要拆下来导航看一下后边的线插有没有松动。|车主说：我早上拆了，接口都插了，也没用|技师说：那就是导航音频输出有问题|车主说：那就是收音机里面有问题了，是吧|技师说：是的|车主说：还有，就是问下，车子1档起步抖动大，是什么原因呢，像榔头敲一样。|技师说：发动机爆震燃烧，清洗节气门，喷油嘴,如果导航线插没有问题，有可能导航输出音频有问题。
10,Q5011,沃尔沃,沃尔沃S40,大师好，请问老款沃尔沃s40正时皮带断了，现在正时怎么对吗？,技师说：这款车需要曲轴转到一缸压缩上止点，凸轮轴 曲轴专用工具定位，在挂正时链条的时候，先把可变正时vvt固定螺丝松了，挂好链条，上好张紧器，然后再紧上螺丝，下面给您相关图片参考|技师说：[图片]|技师说：[图片]|技师说：如果顶气门的话，还需要抬缸盖。|技师说：最好专用工具定位|技师说：看上面图片|车主说：没有专用工具|车主说：没有顶气门|技师说：一样吗|车主说：？|技师说：图片一样吗|技师说：没有工具 只能照图片对|车主说：一样的|车主说：现在那个曲轴链轮全部拿下来了，没有做记号怎么对|技师说：那就好|车主说：？|技师说：链轮？不是皮带的吗？|车主说：不是皮带轮，是正时皮带的链轮|技师说：正时皮带 哪来的链轮！|技师说：看图片啊|技师说：图片发给您了 ，剩下的需要您自己对啦|车主说：曲轴皮带轮的里面那个正时轮|车主说：全掉了|车主说：拿下皮带轮的时候把里面那个轮子全拔下来了|技师说：您可以发几个图片吗|车主说：现在不在家|技师说：上面有标记 对好安装就行了|技师说：[图片]|技师说：[图片]|技师说：[图片]|技师说：[图片]|技师说：[图片]|技师说：[图片]|技师说：[图片]|技师说：这些您看看|车主说：一缸上死点怎么看|技师说：啊！火花塞拆下来 改锥塞进去 转曲轴|技师说：您是同行吗，没有这方面经验 最好找老师傅帮忙 避免出错|技师说：我现在出去一下，有问题留言，我看到后 会在第一时间回复您|技师说：最好看到发动机 再和您细说，这样说 您不会明白,这款车需要曲轴转到一缸压缩上止点凸轮轴位置标记对好机体12点方向的标记，曲轴标记差不多也在12点方向，下面给您相关图片参考
11,Q5012,大众,速腾,大众速腾315导航四维图新地图最新版本是哪一年的,技师说：现在是17年的，不建议你做升级，因为即使升级，导航还是不准。现在基本没有来店升级。|车主说：你哪里能升级吗,导航可以进行升级，（每个4s店都可以，大约4-600）
12,Q5013,丰田,皇冠,这是什么毛病？清除故障码了，又出来？,技师说：节气门位置传感器问题。建议你找专业的电脑做一下节气门初始化匹配。|车主说：太专业了吧！|技师说：不过这个故障确实需要匹配一下节气门|车主说：电脑上操作吗？|技师说：是的|车主说：现在开车不影响吧！|技师说：只要车辆发动机正常，提速没有问题，那就不影响车辆正常行驶。,节气门位置传感器问题。建议你找专业的电脑做一下节气门初始化匹配。
13,Q5014,大众,速腾,各位老师好，我的车是大众速腾15年280旗舰版的，高配，原车导航是RNS315，我比较喜欢导航上的罗盘仪功能，车启动后在仪表盘上显示东西南北方向，感到很方便，就是地图是四维图新的，升级太慢了，现在大众厂家四维图新地图最新版本是什么,技师说：15年的车可以进行导航地图升级。大约3-500左右，|车主说：最新地图版本是201606吗|车主说：请帮忙指教|技师说：升级就是订购一个内存卡。安装在你的车上导航上。具体的版本号也没注意。我们一年也不做一台车|车主说：看看是哪一年的版本，如何是17年的我要一个|技师说：你去4s店订购一个。|技师说：顺便看一下你导航系统的版本。|车主说：你哪里没有啊|技师说：我们不提供线下服务哦。|技师说：导航卡订购后，需要4s店帮你激活|技师说：每个4s店都可以进行升级|车主说：4S店说没有17年的版本|技师说：只有16年的？,原车导航升级需要到4s店购买升级卡。（最近年限）同时需要进行激活。
14,Q5015,别克,昂科威,我的车辆最近出现感应不到钥匙，更换了电子也是感应不到。到底哪里出错了？,技师说：你好，你这种情况考虑是车辆的遥控器输出信号不稳定造成的，这种故障表现，，需要去专门配汽车钥匙的地方重新做一下车辆遥控器的匹配。|车主说：两把钥匙都没有用感觉是失灵的状况。|车主说：备用钥匙经常放家里的|车主说：去了4s店检测了，检测不出任何毛病|车主说：这个情况怎么处理？大师|技师说：匹配了吗？|车主说：大师方便给一下您的号码吗，|技师说：不好意思，汽车大师平台不允许我们留联系方式，还请见谅|车主说：我已经让配钥匙师傅弄过了，|车主说：可是师傅说的是什么数据丢失了。|车主说：你看这个怎么处理|技师说：什么数据丢失？|技师说：估计是钥匙编码吧？普通的外面的配钥匙的配不了，需要去4s|车主说：反正现在车的智能系统已经不管用了|车主说：都是用的应急启动车辆|技师说：4s维修人员没有检查出问题？|车主说：是的|技师说：这种情况，遥控器钥匙，防盗控制模块，线路，都有影响|车主说：那咋办|技师说：这种故障，我只是给你大概分析。具体排查还需要找专业的维修人员帮你排查。用电脑读取一下防盗系统的数据流判断|车主说：可是4s也查不出所以然来，我还能到哪里去查|技师说：当地还有没有另一家4s或者是别克专修？？|车主说：五家4s都去过了|车主说：还能怎么办？|技师说：车辆还在不在质保期内？|车主说：在的|技师说：这个好办，直接找当地的电台，媒体，要求4s向厂家反馈故障，厂家可以下派技术员|车主说：这个是不是有点夸张|技师说：不夸张了，我之前就遇到过，一个奥迪|车主说：连我都觉得这个比较难办|技师说：估计还是4s不愿给你维修，敷衍你,你好，你这种情况考虑是车辆的遥控器输出信号不稳定造成的，这种故障表现，，需要去专门配汽车钥匙的地方重新做一下车辆遥控器的匹配。
15,Q5016,日产,轩逸,日产轩逸报故障，左前预张紧器2开路,技师说：这个是车辆驾驶室位置的安全带底座这一块有问题造成的故障，车辆出过事故以后，安全带底座位置需要进行修复的。|车主说：修复之后出现的故障|技师说：那还是没修复好。|车主说：[语音]|车主说：右前修了|车主说：左前没修|技师说：左前也需要修复的|车主说：[语音]|车主说：[语音]|技师说：是的，修复就可以解决问题|车主说：[语音]|技师说：你可以关注我，以后有问题可以一对一咨询我|车主说：[语音]|技师说：哈哈??。,这个是车辆驾驶室位置的安全带底座这一块有问题造成的故障，车辆出过事故以后，安全带底座位置需要进行修复的。
16,Q5017,大众,高尔夫,高尔夫6七速自动挡，在挂入手动模式行驶一段路后。再次切换为自动模式D档时，会出现熄火系现象，尤其是低速转弯和1-2档的时候。然后松开油门在轻踩时可行驶，但电脑显示屏会出现手动1档（此时是D档位）。,技师说：7速双离合器变速箱吗？|车主说：对|车主说：您好|技师说：有可能机电单元或者档位开关有问题，需要到4s店检查确认一下|车主说：好的，谢谢您。,根据你的描述，以及沟通情况，有可能是档位开关的问题，需要用电脑检查一下变速箱系统有没有故障代码。
17,Q5018,别克,英朗,导航的sd卡怎么拿下来啊。我是2016别克英朗15N自动豪华型车,技师说：你好，你这款车是原装的导航还是后改装的导航一体机？|车主说：是在我屏幕上装的导航|车主说：不是原装的|技师说：导航上的卡在后面的导航模块里面，需要拆下来|车主说：回去问装的人的话太远了|车主说：怎么拆下来，在哪啊|技师说：[图片]|技师说：导航一体机拆卸后，在后面|车主说：好的，谢谢,导航上的卡在后面的导航模块里面，需要拆下来
18,Q5019,力帆汽车,力帆520,吉利全球鹰蚝油，不知道什么，差不多合八毛一公里，,技师说：你好，这种情况一般是车辆发动机积碳问题或者是火花塞间隙量过大造成的，这种油耗增高的现象，建议你去修理厂检查下火花塞的间隙量，清洗一下进气道积碳和三元催化器。|车主说：这些不懂|车主说：大概要多少钱|技师说：更换新的火花塞，清洗进气道积碳，三元催化器 全部下来大概在300之内。|车主说：好谢谢了,你好，这种情况一般是车辆发动机积碳问题或者是火花塞间隙量过大造成的，这种油耗增高的现象，建议你去修理厂检查下火花塞的间隙量，清洗一下进气道积碳和三元催化器。
19,Q5020,斯柯达,晶锐,11款晶锐，主驾玻璃升降开关，按有时候按上结果玻璃降，有时候按一下没反应，升副驾驶的玻璃，一键升到顶后有又自动降一点。副驾驶玻璃升降开关也偶尔没用，反正各种抓狂，按键不能每次正确执行指令。请问是什么原因，有可能是行车电脑故障吗，还是更换按键就能解决？,技师说：你好车主，根据你的描述，不是行车电脑的问题，有可能玻璃升降器开关（左前门）不好或者玻璃导槽有脏东西，或者车门铰链线路接触不良|车主说：行车电脑故障有导致这个问题的可能性吗？|技师说：可能性很小|车主说：好的，那我先换开关试试看吧,根据你的描述，建议先清洗一下玻璃导槽，如果不行，需要更换玻璃升降器。
20,Q5021,奥迪,奥迪Q5,我的车，驾驶位置的窗户摇不下来了，按了按钮没反应，突然这样，不知道为什么？其他三个窗户都好好的,技师说：你好，先检查一下车辆仪表台左侧的保险盒里面的保险丝是不是有问题？这种故障用电脑可以调取一下相关的故障码进行分析。|技师说：[图片]|车主说：这个我自己能看吗？还是得找修理厂？|技师说：[图片]|技师说：可以自己看，把这个板撬开，|技师说：[图片]|技师说：39号看下。|车主说：[图片]|车主说：看了我能干嘛呢？??|技师说：那就去修理厂检查一下吧,你好，先检查一下车辆仪表台左侧的保险盒里面的保险丝是不是有问题？这种故障用电脑可以调取一下相关的故障码进行分析。
21,Q5022,英菲尼迪,英菲尼迪G系,我车买的是二手的，仪表盘有几个灯泡坏了，我车原来公里数是6万多公里。就暂时换一个仪表盘，装上去我的车公里数显示14万公里。这有没可能是车原来的公里数？,技师说：你好，你这种情况确实有可能是车辆仪表盘用专用的电脑调过公里数，车辆仪表盘拆卸以后，重新恢复程序，里面的公里数就显示出来了。|车主说：因为暂时给我换的仪表盘，我看是好像车拆出来的|车主说：我之前那个仪表盘他说拿去帮我修回，但是换回上去|技师说：这个不是你车辆原来的公里数，这是更换仪表盘里面记忆的公里数。|技师说：你这种情况是属于正常现象，没有任何问题。|车主说：所以我车应该是没改过公里数？|车主说：因为我原来那个仪表盘才6万公里，怎么换了一个变成14万公里觉得有点不对劲|技师说：没问题的，放心吧！|车主说：就是每个仪表盘都有记录的公里数每一个不一样？|技师说：是的，没错,这个不是你车辆原来的公里数，这是更换仪表盘里面记忆的公里数。你这种情况是属于正常现象，没有任何问题。
22,Q5023,大众,帕萨特,对正时的大众，车子着热了一直报4缸不发火怎么回事,技师说：点火线圈互换一下，测量一下汽缸压力|车主说：缸压6.5个|车主说：点火线圈互换了，还是报4缸|技师说：缸压低了|技师说：其他的也这么低？|车主说：其他在10左右|技师说：这车做过什么维修？|车主说：加速到2000转故障灯就不闪了，转速上去之后不像缺缸的样啊|车主说：怠速故障灯就闪|技师说：转速高了，根本看不出来|车主说：就是我前天问你可变正时的车|车主说：凉车就很稳|车主说：着一会就不行了|技师说：缸压低|技师说：检查液压挺住，以及气门|车主说：我缸筒打机油比之前好了点|技师说：这个问题需要拆缸盖|车主说：这发动机有没有往缸筒里面喷机油的喷嘴|技师说：有|车主说：我怀疑是不是它堵了|技师说：不是,根据你的描述以及沟通情况，如果缸压低，需要拆缸盖，检查气门，以及活塞环。
23,Q5024,雪铁龙,雪铁龙C5,你好！问一下，雪铁龙C5车，10款2.3换变速箱油用什么机油，用多少升,技师说：你好，重力更换需要4L  循环机更换一次需要12L|技师说：自动变速箱油，美孚，道达尔都可以|车主说：大概需要多钱|车主说：美孚跟道达尔那个能好点|车主说：重力加好，还是循环加好|技师说：两种油差不多??，都可以。循环机更换的话更换得更加彻底，|车主说：油用什么型号的？|技师说：自动变速箱油 ATF油。|技师说：道达尔的MV LV就可以|车主说：有的说怎么用AMT的油|车主说：美孚用的用什么型号的油|技师说：ATF220,你好，重力更换需要4L  循环机更换一次需要12L
24,Q5025,奔驰,奔驰E级,1喇叭单声道 2左右大灯之前一直闪 之后右大灯不亮了 左灯还闪 3后牌照灯报警 4雷达右前一直报警 5空调中间转速时有哒哒声 6esp报警 定速巡航限速等不能使 基本除了喇叭和空调以外的问题全是和电有关系 上次原厂小电瓶坏了的时候也差不多是这些问题 我怀疑是差不多两年前换的小电瓶质量不行引起的这些问题,技师说：有电瓶测试仪吗，可以测量一下电瓶。|车主说：有两块电瓶，一大一小，大的着车14v 左右，小的12.多，正常吗|技师说：电瓶需要使用电瓶测试仪进行检查，万用表不准的|技师说：只是一个参考值|车主说：正常值是多少|技师说：正常不低于12V|车主说：如果不低于十二v电瓶就没事呗|车主说：用电脑读的数据流电压正常|技师说：用电瓶测试仪测量电压以及电流,根据你的描述，以及之前维修情况，需要用电瓶测试仪检查电瓶，，必要时进行更换。
