Unnamed: 0,QID,Brand,Model,Question,Dialogue,Report
83,Q5084,荣威,荣威550,荣威550自动挡，发动机刚大修完，但是一直喷防冻液，缸垫换了3次不行，节温器取了也不行，怎么回事啊,技师说：你好。发动机大修的，缸套看过和缸体间隙是多少没有？还有空气拍了没有，防冻液是不是会少|车主说：我不知道看没看啊|车主说：空气排了，每次加了着车停长时间|车主说：怎么排空气呢|技师说：要喊他看一下，这个车发动机水温高，一般是换总成，换汽缸垫没用|车主说：缸垫冲了 3次了。。？|技师说：在上水管位置，铁水管有个空气螺丝，拆了加防冻液，水管流水出来就是够了的|车主说：排气应该是排了的。这个修理工应该都知道吧|技师说：只有拆了缸盖。考缸套和缸体间隙，这个车缸套要比缸体高6-8丝|车主说：我有点不懂??|车主说：不是专业的哈哈|技师说：这个要去大修发动机的地方处理，|技师说：这样处理了还是不行，只有换总成|车主说：车就在修理店。都20多天了没找到原因|车主说：换总成多少钱|技师说：应该是缸体和缸套，还有看一下进气管胶圈有没有漏水|技师说：总成1万左右|车主说：天。。。。|技师说：这个比较贵的|车主说：说缸盖不平，去把缸盖整了还是不行|技师说：这个发动机设计有问题|技师说：缸盖一般是没问题的，主要是缸体和缸套|车主说：大修都花好几千了。。。。|技师说：这种发动机。我们上次修6500左右。修了自己都后悔了，返工几次，水温高，防冻液少|车主说：缸体和缸套需要怎么弄，我明天和修理工说说|车主说：我花了6000。|技师说：价格差不多|车主说：这车是刚买的二手车。。。疯了|技师说：就给他说，缸套要比缸盖高一点，6-7丝，都是上次镗缸过来我们返工给我们说的，大修这个|车主说：你们大修完也是高温，喷防冻液？|技师说：这个车。发动机高温，基本上不修，第一次换了汽缸垫不行，直接换发动机|技师说：差不多和你一样|车主说：我的不是高温修的。修之前不高温。|技师说：这个发动机设计有缺陷|技师说：我们是烧机油，不好启动修的，修了就高温|车主说：换发动机多少钱啊。。|技师说：还有喊他看一下是不是缸套松了，没有安装好|技师说：上次拆这个活塞，缸套直接一起出来|技师说：1万|车主说：修花了6000多不如换来着。。。|技师说：他也是肯定第一次修这个发动机，不知道这个发动机咬手|车主说：那其他原因基本不用看了吧|车主说：他现在都不知道什么原因。各种配件换。。。|技师说：主要是缸套，缸体。进气管胶圈，还有看一下水泵|技师说：水箱堵塞没有|车主说：水泵是新换的|技师说：就把水泵排除|车主说：水箱堵怎么看呢|技师说：这个说实话。该换个总成|车主说：太贵了。。我的车才4万买的。。。|技师说：拆下来清洗了看看，主要是里面的散热条|车主说：修之前没有高温症状，应该也不是水箱的问题吧。|技师说：应该就是缸体，缸套。进气管胶圈|车主说：进气管换了新的。。。。|车主说：他们以为进气管堵了。。换了新的还是不行|技师说：不是进气管，是进气管上面的胶圈，他没有用密封胶安装也会影响的。漏水|技师说：漏进缸体里面|车主说：用密封胶了|技师说：没有吧胶圈涂抹好，也会漏水|车主说：不是那漏呢|技师说：你修了给钱没有？|技师说：不是进气管，就是缸体，缸套|车主说：给了6000。然后换配件给了300。。。|车主说：发不了小视频|技师说：没有修好就给钱了|技师说：明天喊他拆了缸盖检查缸体，缸套|车主说：不知道啊。。他说修好了。。。然后开的就高温了。说是我车其他原因呢现在。。。哎|技师说：这个明显坑你，|车主说：我都想换地方修了|技师说：换地方，也是要拆缸盖或者发动机，又要给钱|技师说：拆了不一定能搞好|车主说：那咋整|车主说：喷防冻液的地方在前面链接水箱的那个胶管那|技师说：喊他拆了检查缸体，缸套，在检查一下，拆了缸体重新镗缸。然后在安装|车主说：哦。。。明天上午和他说|技师说：可以，明天说了，给我反馈，|技师说：就是把我说的给他说一下。交流一下|车主说：好的。谢啦|技师说：没事|车主说：节温器都取了|技师说：就不是节温器问题|车主说：他把缸盖削了2次|技师说：缸盖应该是没问题的|车主说：他说变形了。。。。削2次不行。。哎|技师说：两次还是不行，他还要销，这个要更换了|车主说：啊|技师说：我明天给你说。要洗澡休息了|车主说：好吧|车主说：修理工说缸盖和缸套那个已经重新整了。|技师说：又拆下来了？|车主说：我去了他自己拆了装好了|技师说：现在水温高不高|车主说：不知道了。。还没装好其他的|技师说：你给他说了我昨晚上给你说的那些没有|车主说：他说不是这个原因，说上次也是高6丝啊|车主说：说了，昨天晚上就给他发微信了|技师说：缸套松了，安装的时候。没有镶好|车主说：已经重新安装了2次了。。。|技师说：汽缸垫铁的？|车主说：缸垫铁的，石棉的都换了。现在石棉加铁的|技师说：只有这样换了上去看看|车主说：奇怪了。。|技师说：还有看过缸体有没有裂痕|车主说：这个应该没有吧|技师说：我的意见还是缸体，缸套|车主说：为什么跑的途中不喷啊|车主说：车减速停下来的时候喷的厉害|技师说：跑起来，保险杠位置有风，给水箱散热了|车主说：那就停着可以看出来不|车主说：开始以为风扇坏了。。|技师说：还有水箱，你把水箱清洗了|车主说：水箱怎么清洗呢|技师说：拆下来清洗，把里面散热条清洗了|车主说：这个过了时间是不就联系不到了|技师说：这个问题24小时关闭|车主说：可以加v不|技师说：[语音]|车主说：好|车主说：。|技师说：？？,主要是检查缸套，缸体，看缸套松动了没有，还有看水箱堵塞没有，把水箱清洗了看看，还是不行，只有更换发动机才可以解决问题
84,Q5085,日产,轩逸,我的车行驶了六万多公里，除了三滤都还没有换过，现在保养需要更换什么,技师说：你好，更换全车油水，机油。变速箱油，刹车油，防冻液，清洗节气门，进气管，燃烧室，三元催化。 检查底盘有没有间隙。刹车片厚薄,大保养。需要更换机油，机滤，空滤，空调滤芯，汽油滤芯，火花塞，防冻液，变速箱油 还需要清洗节气门。喷油嘴，三元催化，
85,Q5086,哈弗,哈弗H6,哈佛H6刹车时有时无是怎么回事,技师说：您是说刹车效果有时好有时坏？|技师说：我的刹车时有时无怎么回事呢|技师说：大部分都有|技师说：是感觉有时踩下刹车可以一脚踩到底有时又踩不到底？还是您踩下一样但是有时能踩着刹车有时又感觉停不下来？|技师说：踩下去停不下来|技师说：只能挂空挡以后就没事了|技师说：就是脚还是不会踩着像空的？|技师说：踩不动了|技师说：和空的一样|技师说：踩的时候跟着赶上一脚效果咋样？|技师说：您的车多少公里了？|技师说：有事行有事不行|技师说：10万多点|技师说：怎么办呢现在|技师说：您检查一下刹车片和刹车油看看是不是刹车片不太厚了|技师说：刹车片和和油都没问题|技师说：油是刚换的|技师说：大部分管用|技师说：一堵车就不好用了，上坡和下坡都不好用|技师说：是不是ABS不管用了？|技师说：不知道啊|技师说：时有时无大部分管用|技师说：踩刹车感觉不管用的时候地方有没有拖的刹车印？|技师说：踩着刹车的时候刹车踏板会不会自己向下延伸一段？|技师说：没有刹车印|技师说：就是感觉踩不动了|技师说：放心空挡就好了|技师说：放在|技师说：就是用刹车太多就会感觉刹车不太好？|技师说：您检查一下真空助力，看看是不是哪里有漏气|技师说：想去4s店看看呢|技师说：通过您的描述，多半是汽车抽真空的效率不高或是真空管路系统有漏气的地方，导致踩刹车次数多的时候真空供应不上，导致真空助力不起作用，刹车系统踩不动效果不好,通过您的描述多半估计是真空助力的管路或是抽真空的效率不太好导致刹车系统踩的次数多的时候抽真空供不应求，刹车系统踩不动，刹车不好。建议检查抽真空的管路
86,Q5087,马自达,马自达CX-5,想买马自达CX5，4s店称顶配车出厂检测程序复杂，所以现在有1月份的车。请问这算库存车吗？如果提这台1月的车会不会影响使用？,技师说：你好，根据不同配置，最高配确实有检测程序，别的配置也会有，只不过相对简单些，一月份的车很正常，这个不必担心，没有任何影响|技师说：一般超过半年才是库存车，一月份的车可能和车辆配置和颜色等因素，放一两个月很正常|车主说：但网上很多说3个月就是库存车了。我这车近3个月了，所以不太放心|技师说：不好意思，刚才有点事耽误了|技师说：三个月完全没有问题的|技师说：这个你完全可以放心，很常见|车主说：好的，谢谢|技师说：不客气，感谢使用汽车大师|车主说：提车要注意些什么啊？|技师说：不好意思，刚才有一台车在检修。|技师说：主要看一下车的表面有没有划痕和碰撞的痕迹，看一下底盘有没有托底的情况，至于性能，可以路试一下。|车主说：谢谢|技师说：好的，不客气，感谢使用汽车大师。,新车确实是有一套检测程序。三个月不算是库存车，一般六个月算是库存车，没有任何影响的，请放心，新车提车时可以检查下外观没有没划痕，底盘有没有磕碰，油液，气压等
87,Q5088,五菱汽车,五菱宏光S,这里找不到车型，我的是重汽豪沃轻卡，六档变速箱，车辆行驶中退三档特别难退，很容易就打齿，这是为什么啊，我速度都减下来了，十几码三档还是进不去！起步加档特别顺，就是四档退三档特别难，很容易打齿，现在都不敢用力，是我速度没把握好？还是方法不对？,技师说：车主您好，如果您的汽车其它档位都非常好挂，四挡减三档的时速是30--40码之间如果不好换挡说明变速箱三档轴，或者同步器坏掉了需要维修更换。如果离合器太低建议把离合器调高试试看|车主说：您好，我的是轻卡|车主说：不是小车|技师说：我知道，您的是货车，原理是一样的,四挡退三档不好挂档，可能的原因是离合器太低，离合器总泵分泵泄压或者需要调整离合器，因为其它档位一切正常，最大的可能性是变速箱，三档同步器或者三档轴损坏，需要从简单的开始检查维修，定期更换变速箱油
88,Q5089,起亚,起亚K3,k3，5年6W公里左右！近段时间开车抖动严重，70-100码严重些。但四轮有点不正该定为了！有关连么,技师说：您好，如果是开起来抖那就检查轮胎是不是扁了，轮胎做动平衡，如果是严重变形那就换钢盆。四轮定位快点做，要不然影响车辆的稳定性。,检查轮胎动平衡，轮胎数据不大的话做了动平衡就不抖了，如果轮胎变形的话做动平衡就没用需要换轮胎，而四轮定位是对车辆稳定性做必要的调整。
89,Q5090,别克,君威,轮胎被扎了钉子，现在应该怎么处理,技师说：你好，不要现在拔掉，可以明天开着去补胎的地方在拔掉，因为扎着钉子，只是轻微的一点漏。如果拔了一夜肯定会没有气了。|技师说：也可以直接换上备胎，等明天拿着轮胎去直接补胎。|车主说：是否可以充气|车主说：[图片]|技师说：可以，但是现在不用。可以坚持到明天。|车主说：好的|车主说：补胎能上高速吗|车主说：去4s吗|技师说：不用去4s店。专业补胎的地方就可以。|技师说：补胎之后，需要放到后轮使用。|车主说：哦哦|技师说：嗯,不要现在拔掉，现在拔掉的话一夜就会没气了。等明天开到补胎的地方再拔掉。或者直接换上备胎，明天拿着轮胎去补胎。补胎之后的轮胎需要放到后轮使用。
90,Q5091,五菱汽车,五菱宏光S3,五菱之光6390A3行驶中一顿一顿的，特别颠簸路，五档高速没感觉，十万公里，已换火花塞，分缸线，不行。,技师说：车主您好，首先检查一下轮胎气压，看看轮胎是不是变形了|技师说：火花塞和高压线已换，你需要检查看看火花塞安装好不好，有些人安装不好会导致点火不好现象一样，还有就是要检查一下配件质量有没有问题啦。更换一下汽油滤芯，如果还不行建议用检测仪器看看电控系统有没有故障码，测一下汽油压力，清洗一下喷油嘴。这样基本应该就能修好啦,行驶中一顿一顿的，一般是火花塞老化点火不好导致，也有可能是点火高压线，高压包，汽油格脏导致的。轮胎变形等，建议车主从简单的开始检查维修，也有可能是更换的配件质量不好或者安装不当
91,Q5092,别克,威朗,汽车行进时仪表盘突然熄灭，几秒后恢复,技师说：你好，之前修理店检查过吗，维修过哪里？|技师说：只出现过一次吗？|车主说：没有|车主说：出现过一次|车主说：只出现过一次|技师说：这种情况属于偶发性故障。可能的原因有仪表打铁线，仪表后方插头虚接|技师说：但是一般不犯毛病状态下不好找|技师说：我建议你再使用观察一段时间。如果后期还会出现这种情况，可以去4s店检查仪表插头是否虚接，退针等情况。熄灭状态大多都是火线或者打铁没有了|车主说：好的，谢谢|技师说：不客气，感谢使用汽车大师。|技师说：您可以关注我，以后有什么问题直接咨询我，祝您用车愉快。,只出现过一次的话属于偶发性故障，可能的原因有仪表插头虚接，导致缺失火线或者打铁，建议在使用观察一段时间。
92,Q5093,本田,本田CR-V,汽车雨刮器换了好几副了，刚买来的前几天没有问题，可是用了1礼拜的样子就有卡兹卡滋的声音，想问下是我车玻璃有问题呢还是说汽车雨刮壁的角度有问题,技师说：你好，换的是雨刮条对吗？可以买一瓶白猫玻璃清洗剂。在玻璃上面喷一层。可以有效的清除异响和刮不净的地方。|车主说：不是全新的雨刮器|车主说：就是用的前几天是完全没问题的，过几天就不行了|技师说：一般和雨刮臂关系不大，另外有安装在雨刮胶条上面的一个小风轮，给雨刮器增加重量。起到和玻璃紧密贴合的效果。|车主说：小风轮是什么|技师说：如果新换的能用几天，基本可以说，玻璃没有问题。|车主说：嗯嗯，那您看有什么解决方法吗|车主说：雨刮器整体都换了4。5副了|车主说：都还是一样的|车主说：和压力有关吗|技师说：贴合紧密度有关系，和胶条质量也有关系，我给用户修车时看见过好几次，就是在胶条上面有一个圆形的风轮，本身是压着雨刮条，紧密和玻璃的缝隙，跑车时会转动，压力会更大，网上应该有卖的|技师说：雨刮条和刮骨是一起换的吗|车主说：是的|车主说：都是买的全新|技师说：都不是原厂的吗|技师说：如果换原厂的还不行，可以考虑更换雨刮臂试试，雨刮臂在4S店应该有质保的|技师说：那个小风轮，你也可以在网上看看。可以试试效果。安装在雨刮器胶条上面。|车主说：找不到啊|车主说：什么小风轮|技师说：另外还有雨刮修复器|技师说：我也搜呢，不知道叫啥，只是看到几个客户车上装了，说是装了刮得挺干净也没有异响了|技师说：汗，没找到，胶条也可以用薄砂纸稍微打磨一下。|车主说：好的|车主说：一般换个雨刮壁多少钱的样子|车主说：还在吗|技师说：那款车？|车主说：2015crv|技师说：左右两只，200多点|车主说：好的|技师说：嗯,可以用白猫玻璃清洗剂轻轻的擦拭玻璃表面还有雨刮胶条。用细砂纸也可以轻轻地打磨一下雨刮胶条，还有专用的雨刮修复器，新胶条能用几天而没有异响，可以说玻璃是没有问题的。如果始终不能解决问题，可以考虑更换一下雨刮臂。
93,Q5094,别克,凯越,车子发动后副驾驶前面有异响，哒哒哒的，很明显，请问有什么通病嘛，大师急急急,技师说：你好，这种情况可能原因有，气门工作声音，碳罐电磁阀异响，发电机轴承或者水泵轴承。或者皮带张紧轮异响。|车主说：是在这个部位|车主说：跟发动机前面没关系吧|车主说：[图片]|技师说：开暖风呢吗|技师说：这是A柱，发动机着车怠速，这里面没有运行工作的部件|技师说：如果开暖风或者开空调，鼓风机在这个里面可能会发出这个声音。|车主说：[图片]|车主说：不是鼓风机|技师说：这个里面是钣金部件，没有运转的东西，如果钣金层松动，怠速的时候也可能有共振|车主说：对|技师说：这个问题不好找了，不能切开找啊，工作量就大了|车主说：在嘛|车主说：现在感觉是发动机很抖，所以那个地方抖出声|车主说：给你给你数据|车主说：[图片]|车主说：[图片]|车主说：传感器1总是变化负度大|车主说：2一直不懂|车主说：动|技师说：2应该是小幅度的变化。如果加油门也不动，可能是有堵塞的情况|车主说：[语音]|技师说：会不会是减震器顶胶，发动机侧的减震衬套看看,a柱里面是钣金层。怠速着车的时候，里面没有部件运转。但是如果钣金层开焊，车身抖动的情况下，有可能会发出异响。可以先检查相连的部件，比如减震器顶胶以及发动机侧的减震衬套等
94,Q5095,丰田,卡罗拉,卡罗拉4万公里，做哪些保养,技师说：你好，几年了？|车主说：3年半|车主说：啥都没有换过，正常一年一次机油三滤|技师说：这个公里数，除了常规的机油和滤芯的更换之外。还需要清洗节气门，清洗喷油嘴，清洗进气道。检查防冻液的冰点，还有制动液的含水量可以视情况更换。检查皮带，老化程度，还有火花塞的间隙可以视情况更换。检查刹车片的厚度，可以视情况更换。检查轮胎磨损程度，可以做一下四轮换位，换位的同时需要做一下四轮动平衡。|车主说：刹车油，变速箱油，用换吗|技师说：手动挡的，变速箱油也需要换了。刹车油和防冻液。，如果没换过也需要|车主说：自动挡的|技师说：变速箱油可以不换，等60000|车主说：好嘞，谢谢你|技师说：好的，不客气，感谢使用汽车大师|技师说：您可以关注我，以后有什么问题直接咨询我，祝你用车愉快。|车主说：关注了，谢谢你|技师说：好的??,除了机油和滤芯的更换之外。还需要清洗节气门，喷油嘴，进气道。更换防冻液和刹车油液。检查皮带还有火花塞，老化程度可以视情况更换。检查刹车片磨损程度。检查轮胎表面磨损程度。可以视情况做一下四轮换位，换位的同时需要做一下四轮动平衡。
95,Q5096,五菱汽车,五菱之光,请问，我的五菱之光有6376NF，465发动机原车的火炬火花塞热值是7，阻值是3.4现在改用铱金，阻值是4.3的能用吗？,技师说：你好，热值是中度偏高吗？比如678，热值差不多就可以了，阻值差的不是太多|车主说：能用不|技师说：可以|车主说：我发觉原来火花塞电极发白，现在发黑，有影响吗|车主说：那是怎么回事|技师说：正常，应该是偏黄色。发黑的话，可能是燃油不好。|车主说：怎么不说话啊？|车主说：哦|技师说：一般阻值相差过大，会有干扰。有时候会体现在仪表上面发生乱码。比如公里数不显示或者显示的不全。|车主说：那热值呢？|车主说：我好像听说|车主说：热值不对，对燃烧有影响|车主说：是不是现在的火花塞热值低，燃烧不好，虽然它是铱金的|技师说：是的，热值如果相差过大会有影响。|技师说：原车如果是七。现在的热值是六七或者八都可以。|技师说：和燃油也有直接的关系。|车主说：那相差多大，才叫大呢|技师说：阻值不是问题，可以用。|技师说：相差大于2|技师说：不好意思，手头有一个车在检修，可能回复的不及时。|车主说：没关系|车主说：那现在的火花塞我也不知道热值是多少，怎么办|车主说：都说铱金的好|车主说：阻值倒是可以量出来|技师说：阻值相差的不是很多。我感觉可以用|车主说：哦|车主说：加速，怠速都好|车主说：燃油经济性，刚换还没觉出来|技师说：点火头比较细，所以点火比较集中。确实是有好处。|车主说：哦|技师说：对，好多车主反应省油了，确实是有好处|技师说：加速，怠速。没有问题，那就可以了，应该没问题，热值没法测量,原车火花塞热值是七。后来换的火花塞热值应该在678左右。不能差太多，至于电阻也不能相差太多，不然会影响点火燃烧，甚至会引起干扰，比如仪表乱码等，这个阻值可以用，就是不知道新火花塞热值合不合适了
96,Q5097,东风风神,东风风神H30,你好，11年手动挡东风风神H30，右侧远光灯泡坏了，更换后右侧远光灯泡仍然不发光，灯泡，保险确定是好的，大灯插头也无进水现象，是怎么回事呢？,技师说：你好。检查一下是不是灯泡插头生锈，或者搭铁线接触不好造成的,检查灯泡插头是不是生锈了，还有检查大灯总成线是不是接触不好
97,Q5098,别克,英朗,请问这管子是起到什么作用的，脱落了又有什么危害,技师说：你好，这是气门室内的废气二次燃烧，和空气滤芯过滤后的空气一起燃烧，|技师说：脱落的话可能会造成怠速不稳|车主说：连接发动机的这头插不到底怎么回事，中间本来就有一个间隙么？|技师说：那个不是插到最低的，有一个间隙，接头本身是一个卡子|车主说：有图片么，能不能让我看下，谢谢|技师说：不好意思，现在没现车，你可以用手拔一下发动机侧的接头，拔不出来就肯定没问题，里面有密封圈|技师说：拔的时候可能有一点间隙松旷的感觉，但是只要拔不出来，就肯定没有问题|车主说：[图片]|车主说：找到一张照片了，没有间隙哦|技师说：绿色那个可以按进去，然后拔出来，从新插进去试试，里面有密封圈，只要不漏气就没有任何影响|车主说：为什么拆过之后，就和原来不一样了|车主说：[图片]|技师说：不好意思，刚才有一台车在检修。|技师说：现在这个状态就没有任何问题了。有点缝隙无所谓，只要不漏气就行。|车主说：感觉很松|技师说：那也没有影响，拆开的时候可以看到，里面有一个很厚的密封圈，可以保证不漏气的|技师说：车辆还在质保期吗？|车主说：对|技师说：你有时间去4S店的话。要求和他们的试驾车兑换一下。用试驾车的也可以，或者直接换一个新的。但是估计不容易换新的，|技师说：换试驾车的容易些|车主说：这个管子叫什么名称|技师说：PCV阀管,这个是PCV阀管，连接气门室内的废气二次燃烧，混合空气滤芯过滤后的空气一起燃烧。脱落的话可能会造成怠速不稳。和渗油等情况
98,Q5099,东风风神,东风风神H30,你好，11年手动挡东风风神H30，右侧远光灯泡坏了，更换后右侧远光灯泡仍然不发光，灯泡，保险确定是好的，大灯插头也无进水现象，是怎么回事呢？,技师说：插头上有没有电，|车主说：插头测有电，不知道是不是虚电|技师说：[语音]|车主说：[语音]|车主说：[语音]|技师说：[语音]|技师说：[语音]|车主说：对|车主说：一边正常，右侧远光不正常|技师说：[语音]|车主说：[语音]|技师说：[语音]|车主说：[语音]|技师说：[语音]|技师说：[语音]|技师说：[语音]|车主说：好的|技师说：[语音]|车主说：[语音]|技师说：嗯，|技师说：客气,你好，根据故障现象分析，建议用万用表或者试灯直接检测灯插头线路，这种情况一般就是插头线路的问题，
